Столы/Журнальные столы,Журнальный стол «Exotic maple»,https://drevodesign.ru/upload/resize_cache/iblock/28f/244_244_0/sjzbq8lze5f6a7qxl2meq1kjwrxqvzpf.png,0195,https://drevodesign.ru/product/stoly/zhurnalnye-stoly/zhurnalnyy-stol-exotic-maple/,от 72 000 руб.,"Эксклюзивный журнальный стол ""Exotic maple"". Основой изделия послужил оригинальный спил массива клена, цветовая гамма массива и природные очертания влюбляют в себя с первого взгляда!!! Заливка эпоксидной смолы выполнена в черном цвете. Финишной покрытие выполнено полиуретановым лаком. Поверхность столешницы идеально отшлифована и отполирована. Основание для данной модели изготовлено из метала и окрашено черной эмалью. У нас на складе имеется огромный выбор различных спилов, возможно изготовление под заказ по всем индивидуальным пожеланиям.",Нет
Столы/Журнальные столы,Журнальный столик «Black Island»,https://drevodesign.ru/upload/resize_cache/iblock/b37/244_244_0/9ooj99d0276pacyvecg1opfulr4wwuay.png,0187,https://drevodesign.ru/product/stoly/zhurnalnye-stoly/zhurnalnyy-stolik-black-island/,36 000 руб.,"Наши мастера закончили работу над еще одним эффектным столиком! При изготовлении данного изделия применялся спил массива горного вяза (карагача), облитый непрозрачной черной эпоксидной смолой. Древесный рисунок на поверхности столешницы бурлит оригинальными узорами, приковывая взгляды снова и снова, а гармоничные линии по периметру столешницы придают эксклюзивность и неповторимость. Столешница идеально отшлифована, финишный слой выполнен водным лаком для прочности покрытия. Основание металлическое. Возможно изготовление под заказ по индивидуальным требованиям и пожеланиям.",Да
Столы/Журнальные столы,Журнальный стол из серии «Beautiful»,https://drevodesign.ru/upload/resize_cache/iblock/a9f/244_244_0/561gf1lrhwnmf3g00jav7jydbrg0tpkx.jpg,0185,https://drevodesign.ru/product/stoly/zhurnalnye-stoly/zhurnalnyy-stol-iz-serii-beautiful/,50 000 руб.,"Эксклюзивный столик от наших мастеров! Оригинальная и неповторимая модель журнального столика из Американского ореха в сочетании с эпоксидной смолой темного оттенка. Изделие прошло несколько стадий шлифовки, поверхность столешницы идеально гладкое и очень приятное на ощупь. Финишное покрытие выполнено полиуретановым лаком. Основание изготовлено так же из массива Американского ореха. Высота журнального столика составляет 360 мм.",Да
Столы/Журнальные столы,Эксклюзивный столик в янтарной заливке,https://drevodesign.ru/upload/resize_cache/iblock/114/244_244_0/hjsz3fboj31n7jxxfce0216n31f5suiu.png,0111,https://drevodesign.ru/product/stoly/zhurnalnye-stoly/eksklyuzivnyy-stolik-v-yantarnoy-zalivke/,68 000 руб.,Неповторимый журнальный столик из необычного слэба карагача в полной заливке янтарной эпоксидной смолой. Настоящий эксклюзив!Толщина столешницы 36 мм.,Да
Столы/Журнальные столы,Журнальный стол «Forest river»,https://drevodesign.ru/upload/resize_cache/iblock/05f/244_244_0/1mq1k29dfreu7jconmfnnwvzvx50iikd.png,0189,https://drevodesign.ru/product/stoly/zhurnalnye-stoly/zhurnalnyy-stol-forest-river/,47 000 руб.,"При изготовлении данной модели наши мастера использовали заготовки горного вяза, которые отлично сочетаются с эпоксидной смолой нежно голубого оттенка. Заготовки обладают очень красивым, ярко-выраженным древесным рисунком, который будет притягивать ваш взгляд снова и снова!!! Поверхность изделия идеально отшлифована и очень приятная на ощупь, каждое тактильное прикосновение будет приносить ощущение сближения с природой и будет дарить вам тепло дерева изо дня в день. Основание выполнено из металла и окрашено в цветовую гамму столешницы. Возможно изготовление под заказ по индивидуальным пожеланиям.",Да
Столы/Журнальные столы,Журнальный стол «Berry»,https://drevodesign.ru/upload/resize_cache/iblock/af6/244_244_0/1g4xw0cmzeevyxsjl05gfrtaj4td5evc.png,0192,https://drevodesign.ru/product/stoly/zhurnalnye-stoly/zhurnalnyy-stol-berry/,30 000 руб.,"Данная модель журнального столика выполнена из заготовок массива черешни с заливкой темной эпоксидной смолой. Наши мастера сохранили природные края, чтобы вы оценили гармоничные изгибы природных линий, которые прекрасно сочетаются с приятным древесным рисунком. Поверхность столешницы идеально отшлифована и отполирована, по тактильным ощущениям очень приятная на ощупь. Подстолье изготовлено из металла. Высота изделия составляет 45 см.",Да
Столы/Журнальные столы,Журнальный стол «Fantasy»,https://drevodesign.ru/upload/resize_cache/iblock/5dd/244_244_0/tmpms4okla2fl520pfijatrani8nas78.png,0169,https://drevodesign.ru/product/stoly/zhurnalnye-stoly/zhurnalnyy-stol-fantasy/,53 000 руб.,"При изготовлении столика использовалась эксклюзивная заготовка горного вяза/ карагача в сочетании с черным МДФ, которые придают столешнице оригинальность и неповторимость исполнения. Толщина столешницы составляет 35 мм. Авторское основание для столешницы выполнено из металла и покрыто автоэмалью двух цветов. Изделие гармонично украсит собой практически любой интерьер и будет приковывать взгляды ваших гостей снова и снова.",Да
Столы/Журнальные столы,Журнальный стол «Classic»,https://drevodesign.ru/upload/resize_cache/iblock/702/244_244_0/lrbbr5gnjshxqwi1xxv2c1fl66ioh3bz.png,0127,https://drevodesign.ru/product/stoly/zhurnalnye-stoly/zhurnalnyy-stol-classic/,25 000 руб.,"Вашему вниманию представлен журнальный стол из массива карагача в классическом стиле. Диаметр столешницы составляет 70 см, высота изделия 45 см. Все природные неровности, трещинки и сучки наши мастера пролили эпоксидной смолой молочного оттенка. Тонировка древесины выполнена в благородном древесном цвете. Возможно изготовление под заказ по всем индивидуальным пожеланиям.",Да
Столы/Журнальные столы,Столик из тополя в заливке смолой,https://drevodesign.ru/upload/resize_cache/iblock/3ec/244_244_0/227t331n8jp47hcqq9hmjrtuaemhn9df.png,0193,https://drevodesign.ru/product/stoly/zhurnalnye-stoly/stolik-iz-topolya-v-zalivke-smoloy/,55 000 руб.,"За основу данной модели был взят спил капового тополя, который был полностью залит в эпоксидную смолу голубого оттенка. Изделие отлично дополнит собой любое пространство и украсит вашу зону отдыха. Поверхность столешницы прошла несколько стадий ручной полировки, что придало необычайный шарм. Основание изготовлено из нетипового полуовального профиля и окрашено в золотистый цвет.",Да
Столы/Журнальные столы,Журнальный стол «Enjoy the art»,https://drevodesign.ru/upload/resize_cache/iblock/a7a/244_244_0/a0g15rr6icvt1zk5vssqswf0sw2evdbg.png,0191,https://drevodesign.ru/product/stoly/zhurnalnye-stoly/zhurnalnyy-stol-enjoy-the-art/,от 56 000 руб.,"Закончена работа над еще одним эксклюзивным изделием, журнальный стол ""Enjoy the art"". За основу данной модели взят оригинальный спил клена с очень красивым фрагментом природной пустоты, расположенной по центру. Заливка эпоксидной смолы выполнена в темной цветовой гамме, которая отлично сочетается с данной заготовкой, природный рисунок бурлит своей фактурой и завораживает с первого взгляда. Поверхность столешницы прошла несколько стадий ручной шлифовки и полировки, чтобы каждое прикосновение приносило вам только приятные эмоции. Толщина столешницы составляет 37 мм. Высота изделия 455 мм. На складе имеется большой выбор подобных заготовок, возможно изготовление в различной цветовой гамме.",Нет
Столы/Журнальные столы,Стол «Река» трансформер,https://drevodesign.ru/upload/resize_cache/iblock/0c4/244_244_0/1vimxgonti313xj2g50a5u3assoti7h6.png, 0171,https://drevodesign.ru/product/stoly/zhurnalnye-stoly/stol-reka-transformer/,60 000 руб.,"Столешница изготовлена из эксклюзивных заготовок массива горного вяза/карагача с заливкой эпоксидной смолы светло-черного оттенка. Толщина столешницы составляет порядка 20 мм. Идеально отшлифованная поверхность столешницы будет манить к себе снова и снова, вы никогда не устанете от эмоций, которые будете получать при тактильных прикосновениях. Финишное покрытие выполнено экологически чистыми немецкими маслами. Подстолье металлическое, с нанесением порошкового покрытия. Высота изделия может варьироваться от 50 до 70 см. Возможно изготовление под заказ по индивидуальным пожеланиям.",Да
Столы/Журнальные столы,Журнальный стол «Decor»,https://drevodesign.ru/upload/resize_cache/iblock/fc3/244_244_0/hm1twal2m46146v9siz6ceh099vfq6nn.png,0196,https://drevodesign.ru/product/stoly/zhurnalnye-stoly/zhurnalnyy-stol-decor/,35 000 руб.,"При изготовлении данного изделия мы взяли за основу гармоничный слэб горного вяза (карагач), все трещинки и природные неровности заполнили эпоксидной смолой и получили прекрасную модель журнального столика. Он отлично впишется в различный интерьер и подарит вам тепло живой древесины. На поверхности столешницы бурлит своими очертаниями неповторимый древесный рисунок, все идеально отшлифовано и отполировано, чтобы радовать вас как при тактильных прикосновениях, так и от одного взгляда. Подстолье выполнено из металла и окрашено в черный цвет. Возможно изготовление под заказ.",Да
Столы/Журнальные столы,Журнальный столик из массива ореха,https://drevodesign.ru/upload/resize_cache/iblock/ae4/244_244_0/j5bja6vrnhqm7l7if3id2m833mthg5ff.png,0186,https://drevodesign.ru/product/stoly/zhurnalnye-stoly/zhurnalnyy-stolik-iz-massiva-orekha2/,36 000 руб.,"Аккуратный журнальный столик из ореха залитого эпоксидной смолой, финишное покрытие столешницы выполнено лаком, толщина столешницы 20 мм. Основание изготовлено из металла и окрашено черной эмалью. Возможно изготовление на заказ по индивидуальным размерам.",Да
Столы/Журнальные столы,Журнальный стол из массива Американского ореха,https://drevodesign.ru/upload/resize_cache/iblock/ee0/244_244_0/pg7n7lflm4k4met182m71hkn0nmics39.jpg,0173,https://drevodesign.ru/product/stoly/zhurnalnye-stoly/zhurnalnyy-stol-iz-massiva-amerikanskogo-orekha2/,от 35 000 руб.,"Столешница изделия сделана из массива американского ореха (черное дерево) в сочетании с заливкой эпоксидной смолы молочного оттенка. На поверхности бурлит оригинальный древесный рисунок, а пролитые смолой небольшие трещинки и сучки придают эксклюзивности изделию. Поверхность столешницы прошла несколько этапов шлифовки и полировки, перед тем, как будет вас будоражить ощущениями после тактильных прикосновений. Приблизьтесь к естественной красоте природы! Толщина столешницы около 23 мм. Высота изделия 45 см. Подстолье выполнено из металла. Возможно изготовление под заказ по вашим индивидуальным пожеланиям.",Нет
Столы/Журнальные столы,Журнальный стол с эпоксидной смолой,https://drevodesign.ru/upload/resize_cache/iblock/0b2/244_244_0/ga6t4z4ga3cg33i72oklouhkbqcxe7ty.png,0157,https://drevodesign.ru/product/stoly/zhurnalnye-stoly/zhurnalnyy-stol-s-epoksidnoy-smoloy/,27 000 руб.,"Изделие выполнено из массива капового тополя с заливкой эпоксидной смолы синего цвета. Основание металлическое, высота изделия составляет 45 см, толщина столешницы 25 мм. Оригинальные и неповторимые линии дерева создадут впечатление уединения с природой, ваша зона отдыха заиграет новыми красками и преобразиться вместе с уникальным изделием. Финишное покрытие сделано полиуретановым лаком для защиты поверхности столешницы.",Да
Столы/Журнальные столы,Журнальный стол «Exotic maple»,https://drevodesign.ru/upload/resize_cache/iblock/28f/244_244_0/sjzbq8lze5f6a7qxl2meq1kjwrxqvzpf.png,0195,https://drevodesign.ru/product/stoly/zhurnalnye-stoly/zhurnalnyy-stol-exotic-maple/,от 72 000 руб.,"Эксклюзивный журнальный стол ""Exotic maple"". Основой изделия послужил оригинальный спил массива клена, цветовая гамма массива и природные очертания влюбляют в себя с первого взгляда!!! Заливка эпоксидной смолы выполнена в черном цвете. Финишной покрытие выполнено полиуретановым лаком. Поверхность столешницы идеально отшлифована и отполирована. Основание для данной модели изготовлено из метала и окрашено черной эмалью. У нас на складе имеется огромный выбор различных спилов, возможно изготовление под заказ по всем индивидуальным пожеланиям.",Нет
Столы/Журнальные столы,Журнальный столик «Black Island»,https://drevodesign.ru/upload/resize_cache/iblock/b37/244_244_0/9ooj99d0276pacyvecg1opfulr4wwuay.png,0187,https://drevodesign.ru/product/stoly/zhurnalnye-stoly/zhurnalnyy-stolik-black-island/,36 000 руб.,"Наши мастера закончили работу над еще одним эффектным столиком! При изготовлении данного изделия применялся спил массива горного вяза (карагача), облитый непрозрачной черной эпоксидной смолой. Древесный рисунок на поверхности столешницы бурлит оригинальными узорами, приковывая взгляды снова и снова, а гармоничные линии по периметру столешницы придают эксклюзивность и неповторимость. Столешница идеально отшлифована, финишный слой выполнен водным лаком для прочности покрытия. Основание металлическое. Возможно изготовление под заказ по индивидуальным требованиям и пожеланиям.",Да
Столы/Журнальные столы,Журнальный стол из серии «Beautiful»,https://drevodesign.ru/upload/resize_cache/iblock/a9f/244_244_0/561gf1lrhwnmf3g00jav7jydbrg0tpkx.jpg,0185,https://drevodesign.ru/product/stoly/zhurnalnye-stoly/zhurnalnyy-stol-iz-serii-beautiful/,50 000 руб.,"Эксклюзивный столик от наших мастеров! Оригинальная и неповторимая модель журнального столика из Американского ореха в сочетании с эпоксидной смолой темного оттенка. Изделие прошло несколько стадий шлифовки, поверхность столешницы идеально гладкое и очень приятное на ощупь. Финишное покрытие выполнено полиуретановым лаком. Основание изготовлено так же из массива Американского ореха. Высота журнального столика составляет 360 мм.",Да
Столы/Журнальные столы,Эксклюзивный столик в янтарной заливке,https://drevodesign.ru/upload/resize_cache/iblock/114/244_244_0/hjsz3fboj31n7jxxfce0216n31f5suiu.png,0111,https://drevodesign.ru/product/stoly/zhurnalnye-stoly/eksklyuzivnyy-stolik-v-yantarnoy-zalivke/,68 000 руб.,Неповторимый журнальный столик из необычного слэба карагача в полной заливке янтарной эпоксидной смолой. Настоящий эксклюзив!Толщина столешницы 36 мм.,Да
Столы/Журнальные столы,Журнальный стол «Forest river»,https://drevodesign.ru/upload/resize_cache/iblock/05f/244_244_0/1mq1k29dfreu7jconmfnnwvzvx50iikd.png,0189,https://drevodesign.ru/product/stoly/zhurnalnye-stoly/zhurnalnyy-stol-forest-river/,47 000 руб.,"При изготовлении данной модели наши мастера использовали заготовки горного вяза, которые отлично сочетаются с эпоксидной смолой нежно голубого оттенка. Заготовки обладают очень красивым, ярко-выраженным древесным рисунком, который будет притягивать ваш взгляд снова и снова!!! Поверхность изделия идеально отшлифована и очень приятная на ощупь, каждое тактильное прикосновение будет приносить ощущение сближения с природой и будет дарить вам тепло дерева изо дня в день. Основание выполнено из металла и окрашено в цветовую гамму столешницы. Возможно изготовление под заказ по индивидуальным пожеланиям.",Да
Столы/Журнальные столы,Журнальный стол «Berry»,https://drevodesign.ru/upload/resize_cache/iblock/af6/244_244_0/1g4xw0cmzeevyxsjl05gfrtaj4td5evc.png,0192,https://drevodesign.ru/product/stoly/zhurnalnye-stoly/zhurnalnyy-stol-berry/,30 000 руб.,"Данная модель журнального столика выполнена из заготовок массива черешни с заливкой темной эпоксидной смолой. Наши мастера сохранили природные края, чтобы вы оценили гармоничные изгибы природных линий, которые прекрасно сочетаются с приятным древесным рисунком. Поверхность столешницы идеально отшлифована и отполирована, по тактильным ощущениям очень приятная на ощупь. Подстолье изготовлено из металла. Высота изделия составляет 45 см.",Да
Столы/Журнальные столы,Журнальный стол «Fantasy»,https://drevodesign.ru/upload/resize_cache/iblock/5dd/244_244_0/tmpms4okla2fl520pfijatrani8nas78.png,0169,https://drevodesign.ru/product/stoly/zhurnalnye-stoly/zhurnalnyy-stol-fantasy/,53 000 руб.,"При изготовлении столика использовалась эксклюзивная заготовка горного вяза/ карагача в сочетании с черным МДФ, которые придают столешнице оригинальность и неповторимость исполнения. Толщина столешницы составляет 35 мм. Авторское основание для столешницы выполнено из металла и покрыто автоэмалью двух цветов. Изделие гармонично украсит собой практически любой интерьер и будет приковывать взгляды ваших гостей снова и снова.",Да
