Зеркала и предметы декора,Зеркало из массива горного вяза,https://drevodesign.ru/upload/resize_cache/iblock/3d5/244_244_0/g3oqp9ali5rm4iijntjcb5rxc1iaye7m.png,0773,https://drevodesign.ru/product/zerkala-i-predmety-dekora/zerkalo-iz-massiva-gornogo-vyaza/,42 000 руб.,"Оригинально зеркало в стиле ""Река"" из массива горного вяза/карагача. Габарит изделия составляет 210 х 100 см. Заготовки рамки идеально отшлифованы и отполированы. При тактильных прикосновениях дерево вам будет дарить тепло и только самые положительные эмоции. Возможно изготовление под заказ в различных цветовых оттенках и размерах.",Да
Зеркала и предметы декора,Комплект кресел из массива в зону отдыха,https://drevodesign.ru/upload/resize_cache/iblock/5a2/244_244_0/823036wcz6yy3pdc06628ll9659el2iw.png,0772,https://drevodesign.ru/product/zerkala-i-predmety-dekora/komplekt-kresel-iz-massiva-v-zonu-otdykha1/,По запросу,"Данные комплект кресел можно назвать настоящим декоративным, эксклюзивным элементом вашей зоны отдыха. Изделия выполнены из массива карагача, ножки металлические. Конструктив изделия исполнен путем соединения между собой большого количества пятиугольных деталей, весь материал отбирался и обрабатывался вручную, далее была кропотливая работа по сборке, но результат оказался просто роскошным. В комплект к креслам идет мягкая накладка для осуществления более комфортной посадки, а так же журнальный столик с эпоксидной смолой в подобном стиле, его диаметр 60 см, основание изготовлено из металла. Возможны различные цветовые исполнения. Стоимость одного кресла 69 000 руб, стоимость столика 32 000 руб.",Да
Спальня,Эксклюзивная кровать из тополя с декоративными элементами из смолы,https://drevodesign.ru/upload/resize_cache/iblock/bcb/244_244_0/midg4t7805okmgcdt3ep49x7i03orzxt.png,0510,https://drevodesign.ru/product/spalnya/eksklyuzivnaya-krovat-iz-topolya-s-dekorativnymi-elementami-iz-smoly/,По запросу,"Настоящий эксклюзив- кровать из тополя в эпоксидной смоле, янтарного цвета. Размер изголовья: ширина переменная от 82 до 67 см., длина 290 см. Изголовье возможно разместить на нужной высоте, подвешивается на стену.  Корпус кровати выполнен из массива тополя с элементами заливки смолой 180 х 200 см. В комплект возможно приобрести прикроватные тумбы, консоль с зеркалом и шкаф. В стоимость входит каркас кровати с ортопедическим основанием и изголовьем.",Нет
Спальня,Кровать из карагача,https://drevodesign.ru/upload/resize_cache/iblock/2ac/244_244_0/115krdmuqcem8fmiv8r9hqku9omr0yn0.jpg,0502,https://drevodesign.ru/product/spalnya/krovat-iz-karagacha/,От 110 000 руб.,"Кровать из карагача под заказ. Возможно изготовление основания кровати в 3-х размерах - 160х200 см; 180х200 см; 200х2000 см. Спинка (слэб) всегда уникален, длина варьируется от 160 до 300 см.",Нет
Спальня,Кровать с подвесными тумбами,https://drevodesign.ru/upload/resize_cache/iblock/bd8/244_244_0/lbu90j1hleo6lqqw0iqxwoy3ztn7fq20.jpg,0504,https://drevodesign.ru/product/spalnya/krovat-s-podvesnymi-tumbami/,От 160 000 руб.,"Кровать выполнена под заказ, тонирована в цвет ""Мербау"". Возможно изготовления под заказ аналогичной. Срок изготовления 30 рабочих дней.",Нет
Спальня,Кровать со слэбом из тополя,https://drevodesign.ru/upload/resize_cache/iblock/9ee/244_244_0/1gk8q8fdu3e12whabwhcqwa4wh1jbxas.jpg,0506,https://drevodesign.ru/product/spalnya/krovat-so-slebom-iz-topolya/,По запросу,"Эксклюзивная кровать из тополя с оригинальным изголовьем из слэба. Яркие заливки эпоксидной смолой, как завершающий штрих в вашем интерьере.",Нет
Спальня,"Кровать ""Модерн""",https://drevodesign.ru/upload/resize_cache/iblock/326/244_244_0/8sbieb0p34teg5ve3s3sfdz05qbv98o1.jpg,0507,https://drevodesign.ru/product/spalnya/krovat-modern/,По запросу,"Кровать под заказ из карагача в тонировке ""тик"". Интересное дизайнерское решение состыковки деталей. Под заказ в любом размере и цвете.",Нет
Спальня,Авторская кровать с уникальным изголовьем,https://drevodesign.ru/upload/resize_cache/iblock/b69/244_244_0/m1msbiifoqb622zgr3lfeni4ft7gedmh.jpg,0508,https://drevodesign.ru/product/spalnya/avtorskaya-krovat-s-unikalnym-izgolovem/,От 170 000 руб.,Любой размер кровати под заказ. Индивидуальный подбор изголовья кровати по вашему дизайну и размеру.,Нет
Спальня,Кровать с изголовьем из слэба карагача,https://drevodesign.ru/upload/resize_cache/iblock/2ef/244_244_0/4dmaqt6nwld7p860bqalzgytw7690rmo.png,0509,https://drevodesign.ru/product/spalnya/krovat-s-izgolovem-iz-sleba-karagacha/,От 85 000 руб.,"Стильная кровать с изголовьем из слэба карагача. Все трещинки и сучки на слэбе залиты прозрачной эпоксидной смолой. Размер изголовья: ширина переменная от 62 см. до 86 см., максимальная длина слэба 197 см. Размер основания кровати: 160 х 200 см. Каркас полностью выполнен из массива карагача. Ортопедическое основание. Слэб оснащен подсветкой холодного свечения. В комплект возможно приобрести комод и прикроватные тумбы, тонированные в единый цвет с кроватью.",Нет
Столовая,"Большой стол из карагача ""Река""",https://drevodesign.ru/upload/resize_cache/iblock/60d/244_244_0/nzu4kebchd54rdh40rjtia3biwearec0.png,0288,https://drevodesign.ru/product/stolovaya/bolshoy-stol-iz-karagacha-reka/,102 000 руб.,"Новое изделие - обеденный стол ""река"" из карагача с синей рекой, станет отличным дополнением к интерьеру загородного дома или квартиры.",Да
Столовая,Уникальный обеденный стол из тополя,https://drevodesign.ru/upload/resize_cache/iblock/5e6/244_244_0/n3fampgsjkhpfk9a9h53qcts4g1536wa.png,0207,https://drevodesign.ru/product/stolovaya/unikalnyy-obedennyy-stol-iz-topolya/,162 000 руб.,Новый уникальный авторский стол из слэбов тополя на металлическом подстолье. Эксклюзивная работа наших мастеров никого не оставит равнодушным. Стол в единственном экземпляре. Финишное покрытие стола выполнено лаком. Возможно изготовление на заказ по индивидуальным размерам.,Да
Столовая,Обеденный стол из ивы,https://drevodesign.ru/upload/resize_cache/iblock/93d/244_244_0/4dyzzyu5eg6lyiexsydnjovhe2xjtfco.png,0205,https://drevodesign.ru/product/stolovaya/obedennyy-stol-iz-ivy/,192 000 руб.,"Новый уникальный обеденный стол из ивы на металлическом подстолье. Стол имеет две полупрозрачные реки, с бирюзовым оттенком. Стол хорошо подойдет для больших обеденных помещений. Возможно изготовление на заказ по индивидуальным размерам.",Да
Столовая,"Обеденный стол из массива акации ""Red forest""",https://drevodesign.ru/upload/resize_cache/iblock/cb3/244_244_0/ql8ho3lt988zl001kbo1js0xgc6epjqy.png,0286,https://drevodesign.ru/product/stolovaya/obedennyy-stol-iz-massiva-akatsii-red-forest/,114 000 руб.,"Большой обеденный стол из массива розовой акации в сочетании с черной эпоксидной смолой с эффектом перламутра. Толщина столешницы составляет 40 мм. Финишное покрытие выполнено экологически чистым прозрачным маслом, идеально отшлифовано и отполировано. Авторское металлическое основание для данной модели изготовлено из металла и покрыто эмалью в цветовой гамме ""Графит"". Высота стола составляет 74 см.",Да
Столовая,"Обеденный стол ""French gray""",https://drevodesign.ru/upload/resize_cache/iblock/620/244_244_0/79qblvwv7zmr9ksdkp6cah0m0sv929ds.png,0234,https://drevodesign.ru/product/stolovaya/obedennyy-stol-french-gray/,126 000 руб.,"Уникальный обеденный стол в сочетании массива карагача и эпоксидной смолы светло-темного оттенка. Поверхность столешницы имеет идеально гладкое покрытие, очень приятное по тактильным ощущениям. Финишное покрытие выполнено полиуретановым лаком. Основание данной модели изготовлено из металла и окрашено в черный цвет",Да
Двери в стиле лофт,Дверь для шкафа-купе,https://drevodesign.ru/upload/resize_cache/iblock/08a/244_244_0/dou2mpqy7uk3eg5slh29jv3kknmfi043.png,1014,https://drevodesign.ru/product/dveri-v-stile-loft/dver-dlya-shkafa-kupe/,По запросу,Изготавливаем двери для шкафов-купе разных размеров и моделей под заказ.,Да
Двери в стиле лофт,Большая амбарная дверь из карагача,https://drevodesign.ru/upload/resize_cache/iblock/13e/244_244_0/d1ylad6lc8ahv12co7me1rm3ys86jh84.png,1013,https://drevodesign.ru/product/dveri-v-stile-loft/bolshaya-ambarnaya-dver-iz-karagacha/,По запросу,"Большая амбарная дверь из клеенного карагача с натуральным, природным краем.",Нет
Двери в стиле лофт,Двери лофт,https://drevodesign.ru/upload/resize_cache/iblock/f18/244_244_0/8aqwai7psh0u1s2tbsahnwvijh2vd725.png,1012,https://drevodesign.ru/product/dveri-v-stile-loft/dveri-loft/,По запросу,Двери в стиле лофт с заливками эпоксидной смолой. Возможно изготовление под заказ в любых размерах.,Нет
Двери в стиле лофт,Амбарная дверь из карагача,https://drevodesign.ru/upload/resize_cache/iblock/395/244_244_0/avv5ow1zge81o3f2gkgwcgad3ufoln5s.png,1011,https://drevodesign.ru/product/dveri-v-stile-loft/ambarnaya-dver-iz-karagacha/,По запросу,Дверь из клеенного массива карагача.,Нет
Двери в стиле лофт,"Дверь ""Река""",https://drevodesign.ru/upload/resize_cache/iblock/bc1/244_244_0/qe1lts1kyhrr2cpgib49e32hwalrp95v.png,1010,https://drevodesign.ru/product/dveri-v-stile-loft/dver-reka/,По запросу,Изготавливаем амбарные двери по индивидуальным размерам под заказ.,Нет
Барные стойки,Барная столешница из карагача в прозрачной смоле,https://drevodesign.ru/upload/resize_cache/iblock/a9e/244_244_0/4fnrt1d0faqma8npuu0qhppwp8ml8rst.png,1107,https://drevodesign.ru/product/barnye-stoyki/barnaya-stoleshnitsa-iz-karagacha-v-prozrachnoy-smole/,81 000 руб.,"Столешница из карагача в прозрачной смоле. Толщина столешницы 35 мм. На светлой стороне столешницы не нанесен финишный слой покрытия (тонировка), что дает вам возможность при заказе выбрать подходящий цвет.",Да
"Мебель для кафе, баров",Столешница для барной стойки,https://drevodesign.ru/upload/resize_cache/iblock/505/244_244_0/4bua9qeztgz9p502d6fzk5iec3atwh6h.png,0402,https://drevodesign.ru/product/mebel-dlya-kafe-barov/stoleshnitsa-dlya-barnoy-stoyki/,46 000 руб.,"Идеальная столешница из карагача для барной стойки: брутальная, большая толщина дерева, элемент стекла для декора.  Цена указана за столешницу, возможно изготовление любого подстолья под ваш размер. На фото основание представлено для примера.",Да
Барные стойки,Барный комплект из массива карагача,https://drevodesign.ru/upload/resize_cache/iblock/bc6/244_244_0/acngpbavr31zlb39lnbzkd43cew5chca.png,0405,https://drevodesign.ru/product/barnye-stoyki/barnyy-komplekt-iz-massiva-karagacha/,90 000 руб.,Барная стойка в комплекте с двумя стульями выполнена из массива карагача. Края стойки с неповторимыми природными неровностями в совокупности с уникальным древесным рисунком не оставят равнодушным не один взгляд. Возможно изготовление по индивидуальным размерам в различной цветовой гамме древесины.,Да
Барные стойки,"Барный комплект ""Smoke""",https://drevodesign.ru/upload/resize_cache/iblock/f1b/244_244_0/h4bqyi0xff7mthww9607k3j73k86zjsn.png,0406,https://drevodesign.ru/product/barnye-stoyki/barnyy-komplekt-smoke/,83 000 руб.,Изделие выполнено из массива карагача в сочетании с эпоксидной смолой. Оригинальные фрагменты заливки и древесного рисунка делают столешницу по настоящему уникальной. В комплекте идут два оригинальных барных стула из массива. Возможно изготовление под заказ в различных цветовых оттенках.,Да
Барные стойки,"Барный стол из серии ""Waterfall""",https://drevodesign.ru/upload/resize_cache/iblock/8dd/244_244_0/ubqckpvp80pt1ye7sufczezf9psef5fa.png,0408,https://drevodesign.ru/product/barnye-stoyki/barnyy-stol-iz-serii-waterfall/,По запросу,"Эксклюзивные барные столы от нашей команды мастеров из серии ""Waterfall"". Характерная особенность данной модели является деревянная опора, которая переходит в столешницу с соблюдением древесного рисунка и заливки эпоксидной смолы. Возможно изготовление из различного материала: карагач, американский орех, каповый тополь, акация. Цветовая гамма и габарит изделия могут быть различными.",Нет
Барные стойки,"Барный комплект ""WooD""",https://drevodesign.ru/upload/resize_cache/iblock/1ac/244_244_0/ur1etzri8u5citha6dxmse92wdxxadi4.png,0407,https://drevodesign.ru/product/barnye-stoyki/barnyy-komplekt-wood/,По запросу,"Еще одна эксклюзивная работа от наших мастеров, эксклюзивная барная стойка из массива горного вяза/карагача в комплекте с барными стульями в цвет стойки. При изготовлении данного изделия в работу была взята заготовка очень интересной природной формы, не часто природа нам подбрасывает настолько оригинальный материал, но не в этом случае!!! Стойка имеет очень эффектный вид и будет притягивать внимание снова и снова, финишное покрытие выполнено экологически чистыми маслами, идеально отшлифовано и отполировано, очень приятное по тактильным ощущениям. Все трещинки, сучки и природные неровности на поверхности столешницы пролиты эпоксидной смолой. Основание данной модели металлическое и окрашено черной эмалью.  Габарит стула: 40х40х81 см. Возможно изготовление под заказ по индивидуальным размерам.",Нет
Барные стойки,Барная стойка из массива карагача,https://drevodesign.ru/upload/resize_cache/iblock/5a0/244_244_0/iwlc41e18dixm4igsqgjssu78pw058fw.png,0410,https://drevodesign.ru/product/barnye-stoyki/barnaya-stoyka-iz-massiva-karagacha/,52 000 руб.,"За основу изделия была взята оригинальная заготовка массива карагача. Все природные очертания были полностью сохранены, потому что лучший художник - это природа! Тонировка столешницы была выполнена экологически чистым маслом немецкого производителя, финишный слой сделан полиуретановым лаком для стабилизации массива. После того как столешница прошла несколько стадий ручной шлифовки и полировки, поверхность стала идеальная гладкой и очень приятной по тактильным ощущениям. Изделие отлично дополнит собой вашу зону отдыха. Основание изготовлено из металла и окрашено в черный цвет. Возможно изготовление под заказ по индивидуальным размерам.",Да
Барные стойки,Барная стойка из массива горного вяза,https://drevodesign.ru/upload/resize_cache/iblock/689/244_244_0/iyzwauyipl8b1ktmt1g9pm3iogxcacrp.png,0409,https://drevodesign.ru/product/barnye-stoyki/barnaya-stoyka-iz-massiva-gornogo-vyaza/,56 000 руб.,"За основу изделия взят слэб горного вяза (карагач). Поверхность столешницы идеально гладкая по тактильным ощущениям, прошла несколько стадий ручной шлифовки и полировки. Тонировка древесины проводилась экологически чистым маслом немецкого производителя, финишный слой выполнен полиуретановым лаком европейского производителя. Основание изготовлено из металла и окрашено в черный цвет. Возможно изготовление под заказ по индивидуальным размерам.",Да
Столешницы/Готовые столешницы,Столешница из массива карагача,https://drevodesign.ru/upload/resize_cache/iblock/866/244_244_0/xe1nezxs78jzeg8o4w6x1q0i3qdkvd3n.png,1108,https://drevodesign.ru/product/stoleshnitsy/gotovye-stoleshnitsy/stoleshnitsa-iz-massiva-karagacha/,57 000 руб.,Столешница выполнена из массива горного вяза в сочетании с эпоксидной смолой янтарного цвета. Толщина столешницы 50 мм.,Да
Столешницы/Готовые столешницы,Столешница из карагача с синей смолой,https://drevodesign.ru/upload/resize_cache/iblock/1c5/244_244_0/nlbqz0slx2bmqnecer4lhlf4piemnhqt.jpg,1104,https://drevodesign.ru/product/stoleshnitsy/gotovye-stoleshnitsy/stoleshnitsa-iz-karagacha-s-siney-smoloy/,101 000 руб.,"Красивая классическая столешница в стиле ""река"" из карагача. Толщина столешницы около 40 мм.",Да
Столешницы/Готовые столешницы,Столешница из ивы под большой стол,https://drevodesign.ru/upload/resize_cache/iblock/a20/244_244_0/khenzsljer6jwtf3cib1f6elnhx2oo6w.jpg,1105,https://drevodesign.ru/product/stoleshnitsy/gotovye-stoleshnitsy/stoleshnitsa-iz-ivy-pod-bolshoy-stol/,168 000 руб.,Яркая и необычная столешница из ивы с большим количеством капов. Неровный натуральный край дерева придает брутальность и эксклюзивность изделию.,Да
Столешницы/Готовые столешницы,Столешница из массива карагача с эпоксидной смолой,https://drevodesign.ru/upload/resize_cache/iblock/e1d/244_244_0/3npuaspykjwuvpwkuttb07kfg0u9em3u.png,1114,https://drevodesign.ru/product/stoleshnitsy/gotovye-stoleshnitsy/stoleshnitsa-iz-massiva-karagacha-s-epoksidnoy-smoloy/,65 000 руб.,"Столешница выполнена из массива карагача с заливкой эпоксидной смолы голубого оттенка. Теплый цвет древесины привнесет в вашу зону идиллию и комфорт, а тактильные прикосновения подарят очень приятные ощущения. Толщина столешницы составляет 37 мм. Подстолье можно изготовить под заказ в исполнении из массива либо металла, окраска возможна в любой оттенок.",Да
Столешницы/Готовые столешницы,"Обеденная столешница ""Cherries""",https://drevodesign.ru/upload/resize_cache/iblock/f35/244_244_0/7ybk5tldabian7cyogqitx2cho6swjcg.png,1111,https://drevodesign.ru/product/stoleshnitsy/gotovye-stoleshnitsy/obedennaya-stoleshnitsa-cherries/,76 000 руб.,"Готовая столешница в сочетании эпоксидной смолы и эксклюзивной заготовки массива черешни. Заливка выполнена в темной цветовой гамме, но через смолу вы можете увидеть всю красоту природы. Внутренние ""берега"" не проходили первоначальную обработку, заливка производилась вместе с корой, что смотрится очень необычно и красиво. Под данную модель подойдут различные модели оснований, за всей подробной информацией обращайтесь к нашим менеджерам.",Да
