Столешницы/Готовые столешницы,Эксклюзивная столешница из массива акации,https://drevodesign.ru/upload/resize_cache/iblock/864/244_244_0/2ozljfel8xjzvl8z6tdzbg6wapnaeoo7.png,1115,https://drevodesign.ru/product/stoleshnitsy/gotovye-stoleshnitsy/eksklyuzivnaya-stoleshnitsa-iz-massiva-akatsii/,143 000 руб.,Эксклюзивная столешница из массива акации с эпоксидной смолой темного оттенка. Поверхность столешницы прошла несколько стадий ручной шлифовки и полировки. Финишный слой выполнен водным лаком который подчеркивает натуральный цвет древесины. По подбору основания для данной модели обращайтесь к нашим менеджерам.,Да
Столешницы/Готовые столешницы,Эксклюзивная столешница из массива капового тополя,https://drevodesign.ru/upload/resize_cache/iblock/79c/244_244_0/qo6i6e49tbeb2xcpxv03iv4v80yqvuf4.jpg,1117,https://drevodesign.ru/product/stoleshnitsy/gotovye-stoleshnitsy/eksklyuzivnaya-stoleshnitsa-iz-massiva-kapovogo-topolya/,93 000 руб.,"Вашему вниманию представлена великолепная столешница из массива капового тополя в сочетании с эпоксидной смолой синего оттенка. Уникальные природные формы изделия привлекают взгляд, будут дарить огромное количество положительных эмоций и чувство сближения с природой. Финишное покрытие сделано тонким слоем эпоксидной смолы. Толщина столешницы составляет 33 мм.",Да
Ванная комната,Столешница под раковину,https://drevodesign.ru/upload/resize_cache/iblock/406/244_244_0/ltnxopabtlgv9ah1pzqqnp34dop663be.png,0902,https://drevodesign.ru/product/vannaya-komnata/stoleshnitsa-pod-rakovinu/,40 000 руб.,Столешница в ванную из карагача с заливкой эпоксидной смолой янтарного цвета. Толщина столешницы 60 мм.,Да
Ванная комната,Столешница из карагача,https://drevodesign.ru/upload/resize_cache/iblock/69a/244_244_0/zc11p145uejtb918d4hqup7dsd4wt15l.png,0901,https://drevodesign.ru/product/vannaya-komnata/stoleshnitsa-iz-karagacha/,22 000 руб.,Цельная столешница из слэба карагача в ванную комнату под раковину или в качестве полочки. Толщина изделия 65 мм.,Да
Столешницы/Столешницы для ванной,Столешница под раковину со смолой,https://drevodesign.ru/upload/resize_cache/iblock/f4d/244_244_0/ouzfbn8xe8d9ug1yney5bl4p174d3nn3.png,0905,https://drevodesign.ru/product/stoleshnitsy/stoleshnitsy-dlya-vannoy/stoleshnitsa-pod-rakovinu-so-smoloy/,30 000 руб.,Красивая оригинальная столешница из цельного слэба карагача с яркой заливкой бирюзовой смолой. Толщина столешницы 40 мм. Цвет дерева с серым оттенком.,Да
Кабинет,Авторский письменный стол из ореха,https://drevodesign.ru/upload/resize_cache/iblock/fd4/244_244_0/azusjllps52wf5t5x07dvy6yk3ihi3nv.png,0816,https://drevodesign.ru/product/kabinet/avtorskiy-pismennyy-stol-iz-orekha/,93 000 руб.,"Авторский письменный стол с выдвижным ящиком на магнитном механизме. Стол красив и эстетичен, подойдет для тех, кто уважает своё рабочее пространство. За таким столом приятно сидеть и удобно работать, он впишется в современный интерьер и будет не только мебелью, но и практичным инструментом.",Да
Кабинет,Письменный стол эксклюзивной серии,https://drevodesign.ru/upload/resize_cache/iblock/f86/244_244_0/8cn4066ttmh8rgh2nta2nlr3u24se1ei.png,0822,https://drevodesign.ru/product/kabinet/pismennyy-stol-eksklyuzivnoy-serii/,145 000 руб.,"Стол из слэба карагача в обрамлении черной эпоксидной смолой в минималистическом стиле будет настоящей изюминкой вашего кабинета. С двумя ящиками, система открывания Tip-on. Высота стола 75 см. Толщина столешницы 40 мм.",Да
Спальня,Эксклюзивная кровать из тополя с декоративными элементами из смолы,https://drevodesign.ru/upload/resize_cache/iblock/bcb/244_244_0/midg4t7805okmgcdt3ep49x7i03orzxt.png,0510,https://drevodesign.ru/product/spalnya/eksklyuzivnaya-krovat-iz-topolya-s-dekorativnymi-elementami-iz-smoly/,По запросу,"Настоящий эксклюзив- кровать из тополя в эпоксидной смоле, янтарного цвета. Размер изголовья: ширина переменная от 82 до 67 см., длина 290 см. Изголовье возможно разместить на нужной высоте, подвешивается на стену.  Корпус кровати выполнен из массива тополя с элементами заливки смолой 180 х 200 см. В комплект возможно приобрести прикроватные тумбы, консоль с зеркалом и шкаф. В стоимость входит каркас кровати с ортопедическим основанием и изголовьем.",Нет
Кровати,Кровать из МДФ с вставками из массива,https://drevodesign.ru/upload/resize_cache/iblock/205/244_244_0/ph1urs58z2gxxpzsykoo03lc6mgkhuhv.jpg,0511,https://drevodesign.ru/product/krovati/krovat-iz-mdf-s-vstavkami-iz-massiva/,От 80 000 руб.,"Корпус кровати изготовлен из МДФ, основание ортопедическое. Высота основания под матрас 25 см. Изголовье выполнено из массива карагача в рамке из МДФ. Возможно изготовление под заказ по вашим габаритам. Прикроватные тумбы можно приобрести отдельно по стоимости от 24 000 руб. за штуку. (Арт. 0621).",Нет
Кровати,Кровать из массива горного вяза,https://drevodesign.ru/upload/resize_cache/iblock/b9c/244_244_0/3v92amvrgma1vb74usk4ozpeb705bszu.jpeg,0512,https://drevodesign.ru/product/krovati/krovat-iz-massiva-gornogo-vyaza/,89 000 руб.,"Авторская кровать полностью выполнена из массива горного вяза. Основание ортопедическое и находится на высоте 25 см от пола. Кровать вскрыта экологически чистым маслом немецкой фирмы ""Biofa"", финишный слой сделан водным лаком для прочности покрытия. Возможно изготовление по индивидуальным размерам, цветовая гамма изделия может быть разной.",Да
Спальня,Кровать из карагача,https://drevodesign.ru/upload/resize_cache/iblock/2ac/244_244_0/115krdmuqcem8fmiv8r9hqku9omr0yn0.jpg,0502,https://drevodesign.ru/product/spalnya/krovat-iz-karagacha/,От 110 000 руб.,"Кровать из карагача под заказ. Возможно изготовление основания кровати в 3-х размерах - 160х200 см; 180х200 см; 200х2000 см. Спинка (слэб) всегда уникален, длина варьируется от 160 до 300 см.",Нет
Спальня,Кровать с подвесными тумбами,https://drevodesign.ru/upload/resize_cache/iblock/bd8/244_244_0/lbu90j1hleo6lqqw0iqxwoy3ztn7fq20.jpg,0504,https://drevodesign.ru/product/spalnya/krovat-s-podvesnymi-tumbami/,От 160 000 руб.,"Кровать выполнена под заказ, тонирована в цвет ""Мербау"". Возможно изготовления под заказ аналогичной. Срок изготовления 30 рабочих дней.",Нет
Спальня,Кровать со слэбом из тополя,https://drevodesign.ru/upload/resize_cache/iblock/9ee/244_244_0/1gk8q8fdu3e12whabwhcqwa4wh1jbxas.jpg,0506,https://drevodesign.ru/product/spalnya/krovat-so-slebom-iz-topolya/,По запросу,"Эксклюзивная кровать из тополя с оригинальным изголовьем из слэба. Яркие заливки эпоксидной смолой, как завершающий штрих в вашем интерьере.",Нет
Спальня,"Кровать ""Модерн""",https://drevodesign.ru/upload/resize_cache/iblock/326/244_244_0/8sbieb0p34teg5ve3s3sfdz05qbv98o1.jpg,0507,https://drevodesign.ru/product/spalnya/krovat-modern/,По запросу,"Кровать под заказ из карагача в тонировке ""тик"". Интересное дизайнерское решение состыковки деталей. Под заказ в любом размере и цвете.",Нет
Спальня,Авторская кровать с уникальным изголовьем,https://drevodesign.ru/upload/resize_cache/iblock/b69/244_244_0/m1msbiifoqb622zgr3lfeni4ft7gedmh.jpg,0508,https://drevodesign.ru/product/spalnya/avtorskaya-krovat-s-unikalnym-izgolovem/,От 170 000 руб.,Любой размер кровати под заказ. Индивидуальный подбор изголовья кровати по вашему дизайну и размеру.,Нет
Спальня,Кровать с изголовьем из слэба карагача,https://drevodesign.ru/upload/resize_cache/iblock/2ef/244_244_0/4dmaqt6nwld7p860bqalzgytw7690rmo.png,0509,https://drevodesign.ru/product/spalnya/krovat-s-izgolovem-iz-sleba-karagacha/,От 85 000 руб.,"Стильная кровать с изголовьем из слэба карагача. Все трещинки и сучки на слэбе залиты прозрачной эпоксидной смолой. Размер изголовья: ширина переменная от 62 см. до 86 см., максимальная длина слэба 197 см. Размер основания кровати: 160 х 200 см. Каркас полностью выполнен из массива карагача. Ортопедическое основание. Слэб оснащен подсветкой холодного свечения. В комплект возможно приобрести комод и прикроватные тумбы, тонированные в единый цвет с кроватью.",Нет
Кровати,Авторская кровать из массива дуба,https://drevodesign.ru/upload/resize_cache/iblock/558/244_244_0/z1ao83sx6pa6vhkbzdqhurk01pl0rivb.png,0513,https://drevodesign.ru/product/krovati/avtorskaya-krovat-iz-massiva-duba/,150 000 руб.,"Авторский спальный комплект из массива дуба от нашей команды мастеров. За основу всей композиции взят огромный слэб дуба. Подобные заготовки большая редкость, а если учесть, что он обладает множеством красивых природных элементов, то можно смело сказать: Это одна из жемчужин наших изделий!!! Основание кровати выполнено так же из дуба, все элементы изделий прошли несколько стадий шлифовки и полировки, все детали покрыты экологически чистым маслом. Кровать оснащена ортопедическим основанием. Стоимость кровати составляет 150 000 руб. Отличным дополнением к кровати будут прикроватные тумбы, они изготовлены так же из дуба в стилистике с кроватью. Стоимость одной тумбы составляет 30 000 руб.. Все возникающие вопросы Вы можете обсудить с нашими менеджерами.",Да
Кровати,Кровать с уникальным изголовьем из массива ореха,https://drevodesign.ru/upload/resize_cache/iblock/7a2/244_244_0/l7467i7hzf4qq3abbzmzzrnd59k4i1jw.png,0514,https://drevodesign.ru/product/krovati/krovat-s-unikalnym-izgolovem-iz-massiva-orekha/,93 000 руб.,"Вашему вниманию представлен уникальный спальный комплект от нашей команды мастеров. Детали кровати выполнены из шпонированного мдф (шпон дуба) и вскрыты экологически чистым маслом немецкого производите. Главной изюминкой комплекта является изголовье, именно здесь расположена самая красивая деталь, которая привлекает внимание снова и снова. Эксклюзивная заготовка американского ореха прошла несколько этапов ручной шлифовки и полировки, очень приятная при тактильных прикосновениях. Все природные неровности пролиты эпоксидной смолой. Изголовье так же оснащено подсветкой, которая может играть роль ночника. В комплект к кровати можно приобрести прикроватные тумбы в той же стилистике. Габарит тумбы составляет 400х450х460 мм. Стоимость одной тумбы составляет 27500 руб. Изделия могут быть сделаны в различных цветах и размерах. При заказе обращайтесь к нашим менеджерам.",Да
Ванная комната,Столешница под раковину,https://drevodesign.ru/upload/resize_cache/iblock/406/244_244_0/ltnxopabtlgv9ah1pzqqnp34dop663be.png,0902,https://drevodesign.ru/product/vannaya-komnata/stoleshnitsa-pod-rakovinu/,40 000 руб.,Столешница в ванную из карагача с заливкой эпоксидной смолой янтарного цвета. Толщина столешницы 60 мм.,Да
Ванная комната,Столешница из карагача,https://drevodesign.ru/upload/resize_cache/iblock/69a/244_244_0/zc11p145uejtb918d4hqup7dsd4wt15l.png,0901,https://drevodesign.ru/product/vannaya-komnata/stoleshnitsa-iz-karagacha/,22 000 руб.,Цельная столешница из слэба карагача в ванную комнату под раковину или в качестве полочки. Толщина изделия 65 мм.,Да
Столешницы/Столешницы для ванной,Столешница под раковину со смолой,https://drevodesign.ru/upload/resize_cache/iblock/f4d/244_244_0/ouzfbn8xe8d9ug1yney5bl4p174d3nn3.png,0905,https://drevodesign.ru/product/stoleshnitsy/stoleshnitsy-dlya-vannoy/stoleshnitsa-pod-rakovinu-so-smoloy/,30 000 руб.,Красивая оригинальная столешница из цельного слэба карагача с яркой заливкой бирюзовой смолой. Толщина столешницы 40 мм. Цвет дерева с серым оттенком.,Да
Столы/Обеденные столы,"Обеденный стол из массива ""Black""",https://drevodesign.ru/upload/resize_cache/iblock/fc6/244_244_0/bviiti9cw07w6zvfz4w32tel0abkrjsf.png,0254,https://drevodesign.ru/product/stoly/obedennye-stoly/obedennyy-stol-iz-massiva-black/,50 000 руб.,Стол изготовлен из массива горного вяза. Финишное покрытие выполнено черной тонировкой в сочетании с полиуретановым лаком. Толщина столешницы составляет 35 мм. На поверхности столешницы присутствует оригинальный древесный рисунок. Возможно изготовление под заказ.,Да
Столы/Обеденные столы,Стол обеденный оригинальный,https://drevodesign.ru/upload/resize_cache/iblock/02c/244_244_0/aeyj9nhvqkfcsnve13datp4oiv5mskuf.png,0230,https://drevodesign.ru/product/stoly/obedennye-stoly/stol-obedennyy-originalnyy/,54 000 руб.,"Интересный, необычный стол с красной заливкой смолой. Устойчивый и компактный  для небольшой кухнми. Ножки из дерева с декором из смолы.",Да
"Мебель для кафе, баров","Стол ""Река"" с темно-синей смолой",https://drevodesign.ru/upload/resize_cache/iblock/c66/244_244_0/a05uslrql0axq6qodkj6quc38jvatari.png,0214,https://drevodesign.ru/product/mebel-dlya-kafe-barov/stol-reka-s-temno-siney-smoloy/,57 000 руб.,"Лаконичный и оригинальный! Обеденный стол из серии "" Река"" из карагача. Толщина столешницы 30 мм. Высота стола регулируется от 74 до 75 см.",Да
Столы/Обеденные столы,Стол с рисунком из смолы,https://drevodesign.ru/upload/resize_cache/iblock/f53/244_244_0/osssedmcfylkqs0d8r7lrqlel0nmbj7z.png,0281,https://drevodesign.ru/product/stoly/obedennye-stoly/stol-s-risunkom-iz-smoly/,47 000 руб.,Обеденный стол  из пламенной березы с орнаментом из смолы. И новыми декоративными металлическими ножками.,Да
Столы/Обеденные столы,Обеденный стол для баров и ресторанов,https://drevodesign.ru/upload/resize_cache/iblock/b21/244_244_0/yggi93q3naqnu20fmraag9j71qbyei5e.png,0256,https://drevodesign.ru/product/stoly/obedennye-stoly/obedennyy-stol-dlya-barov-i-restoranov/,34  000 руб.,"Стол изготовлен из массива горного вяза. Посередине столешницы проходит оригинальная заливка эпоксидной смолой с эффектом перламутра. Основание выполнено из металла, возможны различные исполнения. Цвет подстолья может быть различным. Изделие отлично подойдет для концепции баров и ресторанов. Изделие можно изготовить по индивидуальным пожеланиям в различных цветовых оттенках. При комплексном заказе предусмотрена скидка!!!",Да
Столовая,"Большой стол из карагача ""Река""",https://drevodesign.ru/upload/resize_cache/iblock/60d/244_244_0/nzu4kebchd54rdh40rjtia3biwearec0.png,0288,https://drevodesign.ru/product/stolovaya/bolshoy-stol-iz-karagacha-reka/,102 000 руб.,"Новое изделие - обеденный стол ""река"" из карагача с синей рекой, станет отличным дополнением к интерьеру загородного дома или квартиры.",Да
Столы/Обеденные столы,Стол из тополя в заливке смолой,https://drevodesign.ru/upload/resize_cache/iblock/59d/244_244_0/tzmxqma6awa49umyaaigo38li6xbcmb2.png,0224,https://drevodesign.ru/product/stoly/obedennye-stoly/stol-iz-topolya-v-zalivke-smoloy/,128 000 руб.,"Шикарный обеденный стол из спила тополя, полностью залитый синей эпоксидной смолой. Толщина столешницы 38 мм.  Новое оригинальное и удобное подстолье из металла.",Да
Столы/Обеденные столы,Обеденный стол из тополя «Река»,https://drevodesign.ru/upload/resize_cache/iblock/dbd/244_244_0/mguo7tyxa31ntkxrcan08zt3wa1kj202.png,0201,https://drevodesign.ru/product/stoly/obedennye-stoly/obedennyy-stol-iz-topolya-reka/,70 000 руб.,"Новый обеденный стол из тополя с двумя реками на новом подстолье. Изящные линии тополя прекрасно сочетаются с янтарной эпоксидной рекой, создавая при этом неповторимую композицию, которая отлично подойдет для обеденных помещений в современном стиле и в стиле лофт.",Да
Столы/Обеденные столы,Обеденный стол из массива,https://drevodesign.ru/upload/resize_cache/iblock/933/244_244_0/nkt1bloukx0pdxsa0c5caf7lmehf7gds.png,0237,https://drevodesign.ru/product/stoly/obedennye-stoly/obedennyy-stol-iz-massiva/,45 000 руб.,Круглый обеденный стол из массива карагача. Столешница изготовлена из сращенных ламелей в оригинальных серых тонах. Толщина столешницы 43 мм. Подстолье выполнено из металла и покрашено в цвет столешницы.,Да
Столовая,Уникальный обеденный стол из тополя,https://drevodesign.ru/upload/resize_cache/iblock/5e6/244_244_0/n3fampgsjkhpfk9a9h53qcts4g1536wa.png,0207,https://drevodesign.ru/product/stolovaya/unikalnyy-obedennyy-stol-iz-topolya/,162 000 руб.,Новый уникальный авторский стол из слэбов тополя на металлическом подстолье. Эксклюзивная работа наших мастеров никого не оставит равнодушным. Стол в единственном экземпляре. Финишное покрытие стола выполнено лаком. Возможно изготовление на заказ по индивидуальным размерам.,Да
Столовая,Обеденный стол из ивы,https://drevodesign.ru/upload/resize_cache/iblock/93d/244_244_0/4dyzzyu5eg6lyiexsydnjovhe2xjtfco.png,0205,https://drevodesign.ru/product/stolovaya/obedennyy-stol-iz-ivy/,192 000 руб.,"Новый уникальный обеденный стол из ивы на металлическом подстолье. Стол имеет две полупрозрачные реки, с бирюзовым оттенком. Стол хорошо подойдет для больших обеденных помещений. Возможно изготовление на заказ по индивидуальным размерам.",Да
Столы/Обеденные столы,Обеденный стол с эпоксидной смолой,https://drevodesign.ru/upload/resize_cache/iblock/a2e/244_244_0/8laamop1gassxsx449y7w3hg3zomlpe4.png,0239,https://drevodesign.ru/product/stoly/obedennye-stoly/obedennyy-stol-s-epoksidnoy-smoloy/,63 000 руб.,Обеденный стол из ламелей карагача залитых прозрачной эпоксидной смолой станет уникальным элементом декора вашей столовой группы. Возможно изготовление по индивидуальным размерам.,Да
Столы/Обеденные столы,Спил тополя в прозрачной заливке смолой,https://drevodesign.ru/upload/resize_cache/iblock/33d/244_244_0/69a85f6w8dpt270h0mvfmnn85ogc4b66.png,0221,https://drevodesign.ru/product/stoly/obedennye-stoly/spil-topolya-v-prozrachnoy-zalivke-smoloy/,126 000 руб.,"Шикарный обеденный стол из спила тополя, полностью залитый прозрачной эпоксидной смолой. Толщина столешницы 38 мм.",Да
